[
  {
    "blockNumber": 17500000,
    "timestamp": 1686700000,
    "interest": "12500000000000000000",
    "interestFee": "250000000000000000",
    "poolSupply": "5000000000000000000000000",
    "totalValue": "5210500000000000000000000"
  },
  {
    "blockNumber": 17499500,
    "timestamp": 1686693800,
    "interest": "12400000000000000000",
    "interestFee": "248000000000000000",
    "poolSupply": "4998000000000000000000000",
    "totalValue": "5208200000000000000000000"
  },
  {
    "blockNumber": 17499000,
    "timestamp": 1686687600,
    "interest": "12300000000000000000",
    "interestFee": "246000000000000000",
    "poolSupply": "4996000000000000000000000",
    "totalValue": "5206000000000000000000000"
  }
]
